{"schema_version":1,"run_id":"run-1","profile":"fixture","network":{"name":"test","subnet":"127.0.0.0/8","internal":true},"nodes":[{"name":"node-1","node_id":"0000000000000000000000000000000000000000000000000000000000000000","address":"127.0.0.1","p2p_port":17001,"api_port":18001,"failure_domain":"rack-1","placement_labels":{},"bootstrap_nodes":[],"storage":[{"volume":"node-1/storage","capacity_bytes":1048576}],"resources":{"cpu_limit":1.0,"memory_bytes":1048576,"tokio_workers":1},"identity_fixture":"fixtures/node-1.key","consensus_enabled":true,"compute_enabled":false}],"policies":{"replication_factor":1,"namespace_voter_count":3}}
